{
  "$id": "urn:helix:repo-cp:work-result:1",
  "$schema": "https://json-schema.org/draft/2020-12/schema",
  "type": "object",
  "additionalProperties": false,
  "required": [
    "schema_version",
    "protocol",
    "clean_execution_baseline",
    "work_entry_id",
    "target_repository",
    "objective",
    "canonical_baseline",
    "workspace_evidence",
    "starting_head",
    "ending_head",
    "starting_dirty_state",
    "ending_dirty_state",
    "ending_dirtiness_attribution",
    "files_changed",
    "mutations_performed",
    "mutations_not_performed",
    "validation",
    "evidence_produced",
    "delivery_stage",
    "status_topology",
    "recommended_next_action",
    "live_effects"
  ],
  "properties": {
    "schema_version": { "const": 1 },
    "protocol": { "const": "HELIX_WORK_RESULT_V1" },
    "clean_execution_baseline": { "const": "HELIX_CLEAN_EXECUTION_BASELINE_V1" },
    "work_entry_id": { "$ref": "#/$defs/id" },
    "target_repository": { "$ref": "#/$defs/name" },
    "objective": { "$ref": "#/$defs/text" },
    "canonical_baseline": {
      "type": "object",
      "additionalProperties": false,
      "required": ["intended_ref", "resolved_head"],
      "properties": {
        "intended_ref": { "$ref": "#/$defs/text" },
        "resolved_head": { "type": "string", "pattern": "^[0-9a-f]{40}$" }
      }
    },
    "workspace_evidence": {
      "type": "object",
      "additionalProperties": false,
      "required": ["source_workspace_identity", "execution_workspace_identity", "isolated_execution", "pre_existing_source_state_preserved"],
      "properties": {
        "source_workspace_identity": { "$ref": "#/$defs/text" },
        "execution_workspace_identity": { "$ref": "#/$defs/text" },
        "isolated_execution": { "type": "boolean" },
        "pre_existing_source_state_preserved": { "type": "boolean" }
      }
    },
    "starting_head": { "$ref": "#/$defs/revision_or_unknown" },
    "ending_head": { "$ref": "#/$defs/revision_or_unknown" },
    "starting_dirty_state": { "$ref": "#/$defs/dirty_state" },
    "ending_dirty_state": { "$ref": "#/$defs/dirty_state" },
    "ending_dirtiness_attribution": {
      "type": "object",
      "additionalProperties": false,
      "required": ["current_work_entry", "pre_existing", "unrelated", "unknown"],
      "properties": {
        "current_work_entry": { "$ref": "#/$defs/path_buckets" },
        "pre_existing": { "$ref": "#/$defs/path_buckets" },
        "unrelated": { "$ref": "#/$defs/path_buckets" },
        "unknown": { "$ref": "#/$defs/path_buckets" }
      }
    },
    "files_changed": { "$ref": "#/$defs/unique_texts" },
    "mutations_performed": { "$ref": "#/$defs/unique_texts" },
    "mutations_not_performed": { "$ref": "#/$defs/unique_texts" },
    "validation": {
      "type": "array",
      "items": {
        "type": "object",
        "additionalProperties": false,
        "required": ["check", "status", "evidence"],
        "properties": {
          "check": { "$ref": "#/$defs/text" },
          "status": { "enum": ["PASS", "UNKNOWN", "DRIFT", "BLOCKED", "NOT_APPLICABLE"] },
          "evidence": { "$ref": "#/$defs/text" }
        }
      }
    },
    "evidence_produced": { "$ref": "#/$defs/unique_texts" },
    "delivery_stage": { "enum": ["LOCAL_UNCOMMITTED", "COMMITTED", "PUSHED", "MERGED", "PUBLISHED", "DEPLOYED", "LIVE_VERIFIED"] },
    "status_topology": {
      "type": "object",
      "additionalProperties": false,
      "required": ["nodes", "relationships"],
      "properties": {
        "nodes": {
          "type": "array",
          "minItems": 1,
          "items": { "$ref": "#/$defs/status_node" }
        },
        "relationships": {
          "type": "array",
          "items": { "$ref": "#/$defs/relationship" }
        }
      }
    },
    "recommended_next_action": { "$ref": "#/$defs/text" },
    "live_effects": {
      "type": "array",
      "items": {
        "type": "object",
        "additionalProperties": false,
        "required": ["action", "target", "result", "evidence"],
        "properties": {
          "action": { "$ref": "#/$defs/text" },
          "target": { "$ref": "#/$defs/text" },
          "result": { "enum": ["SUCCEEDED", "FAILED", "UNKNOWN"] },
          "evidence": { "$ref": "#/$defs/text" }
        }
      }
    }
  },
  "$defs": {
    "id": {
      "type": "string",
      "minLength": 1,
      "maxLength": 200,
      "pattern": "^[A-Za-z0-9][A-Za-z0-9._:/@+-]*$"
    },
    "name": {
      "type": "string",
      "minLength": 1,
      "maxLength": 200,
      "pattern": "^[A-Za-z0-9][A-Za-z0-9._/-]*$"
    },
    "text": {
      "type": "string",
      "minLength": 1,
      "maxLength": 4096,
      "pattern": "^[^\\u0000-\\u001f\\u007f]+$"
    },
    "unique_texts": {
      "type": "array",
      "uniqueItems": true,
      "items": { "$ref": "#/$defs/text" }
    },
    "revision_or_unknown": {
      "oneOf": [
        { "type": "string", "pattern": "^[0-9a-f]{40}$" },
        { "type": "null" }
      ]
    },
    "dirty_state": {
      "type": "object",
      "additionalProperties": false,
      "required": ["state", "staged", "unstaged", "untracked"],
      "properties": {
        "state": { "enum": ["CLEAN", "DIRTY", "UNKNOWN"] },
        "staged": { "$ref": "#/$defs/unique_texts" },
        "unstaged": { "$ref": "#/$defs/unique_texts" },
        "untracked": { "$ref": "#/$defs/unique_texts" }
      }
    },
    "path_buckets": {
      "type": "object",
      "additionalProperties": false,
      "required": ["staged", "unstaged", "untracked"],
      "properties": {
        "staged": { "$ref": "#/$defs/unique_texts" },
        "unstaged": { "$ref": "#/$defs/unique_texts" },
        "untracked": { "$ref": "#/$defs/unique_texts" }
      }
    },
    "status_node": {
      "type": "object",
      "additionalProperties": false,
      "required": ["id", "kind", "status", "summary", "owner", "blocking"],
      "properties": {
        "id": { "$ref": "#/$defs/id" },
        "kind": { "enum": ["WORK", "DEPENDENCY", "EXTERNAL_DEPENDENCY", "CROSS_CONTROL_PLANE_REQUEST", "AUTHORIZATION"] },
        "status": { "enum": ["COMPLETED", "ACTIVE", "PENDING", "BLOCKED", "NON_BLOCKING_INCOMPLETE", "UNKNOWN", "DRIFT", "AUTHORIZATION_REQUIRED"] },
        "summary": { "$ref": "#/$defs/text" },
        "owner": { "$ref": "#/$defs/text" },
        "blocking": { "type": "boolean" }
      }
    },
    "relationship": {
      "type": "object",
      "additionalProperties": false,
      "required": ["subject", "predicate", "object"],
      "properties": {
        "subject": { "$ref": "#/$defs/id" },
        "predicate": { "enum": ["BLOCKED_BY", "DEPENDS_ON", "NON_BLOCKING_FOR", "REQUIRES_AUTHORIZATION_FROM", "OWNED_BY", "HANDOFF_TO", "SUPERSEDES"] },
        "object": { "$ref": "#/$defs/id" }
      }
    }
  }
}
